Latin Name;Swedish Name;Info;Commonness;Root;Stem;Leafs;Flower;Seeds;Berries;Sap;Lav Fungi;1=Toxic,       2=Förväxl,   4=PartToxic   Avoid             ;1=Förvildad  2=FörvildaB  3=Invasiv Feral;Protected;Tree;Medicinsk;Army;Allergy
Cardamine pratensis;Ängsbrässma;Ängsbräsma (Cardamine pratensis) är en art i familjen korsblommiga växter som förekommer naturligt från Europa till nordöstra Asien, Japan, norra Nordamerika och Grönland. Arten förekommer i hela Sverige. Smakar likt krasse och små blad samt blommor passar som sallad, spenat eller i soppor. Frön kan användas som krydda. Varianterna Kärrbräsma eller bergbrässman kan trolien användas på likande sätt.;2;;;1;1;1;;;;;;;;;;
Vaccinium vitis-idaea;Lingon;Lingon (Vaccinium vitis-idaea) är ett ris som är vintergrönt. Lingonets bär, som också heter lingon, är ätliga, och mognar i augusti–september. Lingon växer vilt, men går även att odla. ;1;;;;;;1;;;;;;;;2;
Vaccinium uliginosum;Odon;Odon (Vaccinium uliginosum) är en växtart i släktet Vaccinium och familjen ljungväxter. Den beskrevs av Carl von Linné. Arten är ett tämligen högväxt, lövfällande ris med blå, ätliga bär. Den förekommer på fuktig mark över stora delar av norra halvklotet. Eftersom arten ofta växer i samma marker som blåbär förväxlas de ibland. ;1;;;;;;1;;;;;;;;2;
Vaccinium oxycoccos;Tranbär;Tranbär (Vaccinium oxycoccos) är en art i blåbärssläktet i familjen ljungväxter. Växten får röda bär, som är ätliga. I Sverige finns det två arter av tranbär – vanligt tranbär (Vaccinium oxycoccos) och dvärgtranbär (Vaccinium microcarpum). Tranbär växer i stora delar av Sverige. Trots det är det historiskt sett ovanligt att plocka tranbär för att använda i kosten i Sverige, troligtvis för att tranbären är sura.;2;;;;;;1;;;;;;;;2;
Arctostaphylos alpinus;Ripbär;Ripbär är en 5–20 centimeter hög buske som växer i risartade bestånd och breder ut sig tätt intill marken. Bladen får på hösten en stark purpurröd färg och är inte vintergröna;1;;;;;;1;;;;;;;;2;
